{
  "$schema": "./team-manifest.schema.json",
  "schemaVersion": 1,
  "inventory": {
    "agentCount": 14,
    "physicalSkillCount": 848,
    "skillEntrypoint": "SKILL.md",
    "symlinkPolicy": "forbid"
  },
  "agents": [
    {
      "id": "ceo",
      "name": "CEO (Elon Musk)",
      "path": "agents/ceo",
      "focus": "确定公司方向，配置稀缺资源，并基于证据作出跨职能决策。",
      "trigger": "需要拆解公司级或跨职能目标、在多个 C-suite 之间取舍、配置稀缺资源、选择最小充分团队、安排独立复核并综合成最终决策时调用。",
      "outputs": ["决策备忘录", "公司级优先计划", "经验证的高管交接包"],
      "boundary": "负责综合专业意见，不替代财务、法务、安全或工程负责人作出其领域内的最终判断。",
      "doNotUseWhen": "只涉及单一专业领域的判断、已由对应 C-suite 认领的执行细节、关键输入缺失就要拍板，或需要独立证据复核而非综合决策。",
      "skills": {
        "required": [
          "competitive-analysis",
          "executive-decision-system",
          "first-principles-thinking",
          "prioritization-funnel",
          "project-planner",
          "setting-okrs-goals",
          "startup-metrics-framework",
          "verification-before-completion"
        ],
        "optional": [
          "architecture-decision-records",
          "financial-analyst",
          "kpi-dashboard-design",
          "legal-risk-assessment",
          "thinking-elon-musk"
        ],
        "harnessSpecific": [
          "company-investment-research",
          "dispatching-parallel-agents",
          "internal-comms",
          "orchestrate-agi-super-team",
          "web-search"
        ],
        "recommendedExternal": ["planning-with-files"]
      }
    },
    {
      "id": "cto",
      "name": "CTO (Jensen Huang)",
      "path": "agents/cto",
      "focus": "负责技术战略、架构边界、平台经济性与系统可靠性。",
      "trigger": "需要技术战略选择、架构边界划分、接口/API 设计评审、技术选型对比、平台成本评估、系统可靠性设计或故障复盘时调用。",
      "outputs": ["架构决策记录", "技术路线图", "可靠性评审"],
      "boundary": "制定技术方向和约束；工程实现由 PE 负责，数据平台与治理由 CDO 负责。",
      "doNotUseWhen": "实现层面的编码与集成、纯产品取舍、财务与法务判断、数据平台治理。",
      "skills": {
        "required": [
          "api-design-patterns",
          "architecture-decision",
          "architecture-patterns",
          "sre-reliability-governance",
          "tech-decision"
        ],
        "optional": [
          "api-design",
          "architecture-decision-records",
          "cost-aware-llm-pipeline",
          "dashboard-builder",
          "distributed-tracing",
          "docker-essentials",
          "kubernetes-deployment",
          "observability-designer",
          "postmortem-writer"
        ],
        "harnessSpecific": [
          "api-provider-status",
          "model-provider-manager",
          "pre-push-security-scan",
          "provider-key-manager",
          "sentry-automation",
          "token-reporter"
        ],
        "recommendedExternal": []
      }
    },
    {
      "id": "pe",
      "name": "PE (Linus Torvalds)",
      "path": "agents/pe",
      "focus": "把已批准的设计转化为可维护、可测试、可审查且可安全交付的软件。",
      "trigger": "已批准的设计需要跨模块实现、集成、测试、代码评审、缺陷修复或可回退交付时调用。",
      "outputs": ["可运行实现", "回归测试", "可供评审的变更集"],
      "boundary": "负责实现与验证；产品优先级由 CPO 决定，架构例外必须由 CTO 评审。",
      "doNotUseWhen": "设计尚未批准、需要产品或优先级取舍、架构边界存在争议，或只需窄领域专家给出专项建议而不承担跨模块实现。",
      "skills": {
        "required": [
          "e2e-testing",
          "receiving-code-review",
          "requesting-code-review",
          "tdd-workflow",
          "verification-before-completion",
          "vibe-code-auditor"
        ],
        "optional": [
          "bash-pro",
          "cli-developer",
          "docker-essentials",
          "finishing-a-development-branch",
          "github",
          "react-expert",
          "redis-inspect",
          "shell-expert",
          "sql-pro",
          "sql-optimization"
        ],
        "harnessSpecific": [
          "claude-code-runner",
          "code-review",
          "codex-cc-guide",
          "gh-issues",
          "pre-push-security-scan",
          "systematic-debugging"
        ],
        "recommendedExternal": []
      }
    },
    {
      "id": "cpo",
      "name": "CPO (Steve Jobs)",
      "path": "agents/cpo",
      "focus": "把用户问题转化为一致的产品选择、可访问体验与可验证需求。",
      "trigger": "需要产品方向取舍、用户问题定义与需求澄清、体验与可访问性评审、优先级排序或可验证需求拆解时调用。",
      "outputs": ["产品简报", "优先级需求集", "体验评审"],
      "boundary": "负责用户价值与产品范围；技术可行性由 CTO 负责，获客表现由 CMO 负责。",
      "doNotUseWhen": "技术可行性与架构选型、获客渠道与投放执行、跨部门交付排期，或用户证据已充分只需界面与信息架构设计。",
      "skills": {
        "required": [
          "accessibility-compliance-accessibility-audit",
          "feature-requirements-clarification",
          "prioritization-funnel",
          "product-discovery-portfolio-governance",
          "ux-heuristics"
        ],
        "optional": [
          "analytics-tracking",
          "competitive-analysis",
          "customer-success",
          "design-thinking",
          "doc-coauthoring",
          "pm-competitive-teardown",
          "user-story",
          "write-product-documentation"
        ],
        "harnessSpecific": ["deep-research", "figma-automation"],
        "recommendedExternal": []
      }
    },
    {
      "id": "cqo",
      "name": "CQO (Jim Simons)",
      "path": "agents/cqo",
      "focus": "设计可复现的量化研究、回测、组合风险控制与模型评估。",
      "trigger": "需要量化假设设计、回测与复现、模型评估与独立复核、组合风险控制或实验预登记时调用。",
      "outputs": ["可证伪研究假设", "可复现回测", "风险调整后评估"],
      "boundary": "只提供量化证据，不作收益保证；资本配置和实盘行为必须经 CFO 与人类批准。",
      "doNotUseWhen": "需要资本配置与预算决策、实盘下单或交易执行、经营现金流与利润预测，或问题缺少可复现数据与量化口径。",
      "skills": {
        "required": [
          "backtest-expert",
          "backtesting-frameworks",
          "quant-analyst",
          "research-evidence-synthesis",
          "risk-metrics-calculation"
        ],
        "optional": [
          "csv-pipeline",
          "data-analyst",
          "defi-risk-assessment",
          "financial-planning-and-analysis",
          "technical-analysis"
        ],
        "harnessSpecific": [
          "alpha101",
          "backtesting-trading-strategies",
          "company-investment-research",
          "deep-research",
          "trade-prediction-markets"
        ],
        "recommendedExternal": []
      }
    },
    {
      "id": "cmo",
      "name": "CMO (David Ogilvy)",
      "path": "agents/cmo",
      "focus": "基于受众证据建立定位、品牌与可测量的合规获客系统。",
      "trigger": "需要市场定位与品牌策略、渠道增长实验、付费投放或 SEO 方案、获客测量与归因设计时调用。",
      "outputs": ["定位简报", "渠道实验方案", "获客测量计划"],
      "boundary": "负责需求创造与测量；内容生产由 CCO 负责，产品承诺必须经 CPO 验证。",
      "doNotUseWhen": "内容选题、制作与渠道适配执行、产品功能与承诺取舍、定价与预算决策，或缺少受众与转化证据的品牌空转。",
      "skills": {
        "required": [
          "analytics-tracking",
          "brand-identity",
          "competitive-analysis",
          "positioning-growth-experiment-system",
          "seo-audit",
          "traffic-acquisition"
        ],
        "optional": [
          "campaign-analytics",
          "copywriting",
          "data-storytelling",
          "doc-coauthoring",
          "marketing-psychology",
          "programmatic-seo",
          "seo-geo"
        ],
        "harnessSpecific": [
          "deep-research",
          "google-analytics",
          "google-analytics-automation",
          "mailchimp-automation",
          "social-media-management"
        ],
        "recommendedExternal": []
      }
    },
    {
      "id": "cfo",
      "name": "CFO (Warren Buffett)",
      "path": "agents/cfo",
      "focus": "负责经营计划、单位经济、资本配置、定价证据与财务控制。",
      "trigger": "需要预算与滚动预测、单位经济与定价证据、资本配置取舍、财务控制或成本优化时调用。",
      "outputs": ["财务模型", "预算决策", "单位经济评审"],
      "boundary": "提供财务分析而非投资保证；法律条款由 CLO 负责，商业执行由 CSO 负责。",
      "doNotUseWhen": "合同条款与合规判断、销售与客户关系推进、产品范围取舍，或需要实际付款、过账与税务申报操作。",
      "skills": {
        "required": [
          "cost-optimization",
          "financial-analyst",
          "financial-planning-and-analysis",
          "pricing-strategy",
          "startup-business-analyst-financial-projections",
          "startup-metrics-framework"
        ],
        "optional": [
          "bookkeeping-basics",
          "business-analyst",
          "cost-aware-llm-pipeline",
          "invoice-organizer",
          "prioritization-funnel",
          "risk-metrics-calculation",
          "saas-metrics-coach",
          "startup-business-analyst-business-case"
        ],
        "harnessSpecific": ["company-investment-research"],
        "recommendedExternal": []
      }
    },
    {
      "id": "cdo",
      "name": "CDO (Nate Silver)",
      "path": "agents/cdo",
      "focus": "让团队数据可信、可治理、可观测，并能安全支持决策。",
      "trigger": "需要数据契约与口径定义、数据质量与血缘治理、指标体系或分析模型设计、数据安全架构评审时调用。",
      "outputs": ["数据契约", "分析模型", "数据质量评审"],
      "boundary": "负责数据系统与分析完整性；研究解释由 CRO 负责，业务决策仍由相应高管承担。",
      "doNotUseWhen": "研究方法设计与一手证据核验、具体业务决策取舍、生产应用与前端编码实现，或数据授权与合规依据尚未确认。",
      "skills": {
        "required": [
          "analytics-tracking",
          "data-contract-quality-governance",
          "data-engineering-data-pipeline",
          "design-secure-data-architecture",
          "postgresql-database-engineering"
        ],
        "optional": [
          "business-analyst",
          "csv-pipeline",
          "data-analyst",
          "data-storytelling",
          "dashboard-builder",
          "kpi-dashboard-design",
          "senior-data-engineer",
          "senior-data-scientist",
          "sql-pro",
          "startup-metrics-framework",
          "supabase-postgres-best-practices"
        ],
        "harnessSpecific": [],
        "recommendedExternal": []
      }
    },
    {
      "id": "cco",
      "name": "CCO (MrBeast)",
      "path": "agents/cco",
      "focus": "把已验证的选题转化为有辨识度、适配渠道且来源可审查的内容资产。",
      "trigger": "需要内容策略与编辑简报、平台内容适配、选题与脚本结构设计、内容制作编排或来源与权利审查时调用。",
      "outputs": ["编辑简报", "渠道就绪内容", "来源与权利交接包"],
      "boundary": "负责内容策略、制作与适配；分发策略由 CMO 负责，任何外部发布都需人类批准。",
      "doNotUseWhen": "渠道投放与获客测量、产品与定价决策、登录账号或实际发布上传操作，或尚无已验证选题就要出成稿。",
      "skills": {
        "required": [
          "copy-editing",
          "content-research-writer",
          "content-typography",
          "copywriting",
          "data-storytelling",
          "editorial-content-system",
          "jimeng-storyboard"
        ],
        "optional": [